{
  "title": "plan-viewer を C4 モデル準拠の図に作り変えた話",
  "description": "実装プランを 1 枚の自由な箱絵で描いていた plan-viewer を、4 つの縮尺 (Context / Container / Component / Code) で語り直す道具に作り変えた変更を、コードもプロジェクトも知らない人向けに最初から説明します。<a href=\"#glossary:plan-viewer\">plan-viewer</a> とは何か、なぜ <a href=\"#glossary:c4-model\">C4 モデル</a> を採り入れたのか、glossary の <a href=\"#glossary:type-field\">type</a> がレイヤーを決める仕掛け、新しい <a href=\"#glossary:architectureDiagrams\">architectureDiagrams</a> 構造、レイヤー違反を 3 段で弾く防御線、をこの順で読み下します。読み終えると、あなた自身が新しいスキーマに沿ったプラン JSON を書けるようになります。",
  "metaphor": {
    "title": "地図帳の都市計画",
    "description": "C4 モデルの 4 レイヤー (Context → Container → Component → Code) を「広域地図 → 区画地図 → 建物見取り図 → 部屋の家具配置」という縮尺の階段になぞらえます。1 枚の地図にすべての縮尺を混ぜると読めなくなる、というのが旧構造の問題でした。比喩は本文の主役ではなく、あくまでコード説明のあとに『例えるとこれは ◯◯ にあたる』と添える形で使います。"
  },
  "takeaway": "glossary の type で C4 レイヤーが一意に決まり、図はレイヤー別に分かれて自動検証される。これを読めばあなたも新スキーマのプラン JSON を書ける。",
  "glossary": [
    {
      "id": "plan-author",
      "type": "person",
      "name": "プラン作者",
      "icon": "✍️",
      "description": "実装計画やアーキテクチャ説明を JSON で書く人。多くの場合、ベテランエンジニアが新メンバーへ引き継ぐために使う。",
      "analogy": "都市計画図を描く製図技師",
      "responsibility": "glossary と pairs を組み立てて、コードもプロジェクトも知らない読者に通じる物語を作る"
    },
    {
      "id": "plan-reader",
      "type": "person",
      "name": "プラン読者",
      "icon": "👀",
      "description": "完成した HTML をブラウザで開いて読む人。コードベースを知らない前提。",
      "analogy": "初めてその都市を訪れた旅行者",
      "responsibility": "図と物語を順に追って、システムの全体像を理解する"
    },
    {
      "id": "c4-model",
      "type": "external-system",
      "name": "C4 モデル",
      "icon": "🗺️",
      "description": "Simon Brown 氏が提唱したソフトウェアアーキテクチャの可視化手法。Context (システム外の人と外部システム) → Container (デプロイ単位) → Component (コンテナ内の主要要素) → Code (関数・型・テーブル) の 4 段階のズームで描く。",
      "analogy": "全国図 → 県地図 → 市街図 → 建物見取り図、と縮尺を切り替える地図帳の流儀",
      "responsibility": "今回採用した外部規格として、レイヤーの定義そのものを提供する"
    },
    {
      "id": "plan-viewer",
      "type": "client",
      "name": "plan-viewer (Svelte SPA)",
      "icon": "🖥️",
      "description": "plan.json を読み込み、図と物語をブラウザに描く静的 SPA。Vite + Svelte でビルドされ、最終成果物は 1 枚の HTML に JSON を埋め込んで配布される。",
      "analogy": "地図帳を 1 冊にまとめて配本するための印刷所兼閲覧端末",
      "responsibility": "プラン JSON を解釈し、レイヤー別の図とナラティブを画面に並べる",
      "evidence": [
        {
          "path": "plan-viewer/src/App.svelte",
          "label": "ルートコンポーネント"
        }
      ]
    },
    {
      "id": "make-plan-script",
      "type": "server",
      "name": "make_plan.mjs",
      "icon": "📦",
      "description": "plan.json と出力 basename を受け取り、検証済み JSON と、viewer バンドルに JSON を埋め込んだ自己完結 HTML を吐き出す Node スクリプト。",
      "analogy": "地図帳の印刷工程。原稿を製本して 1 冊の本にする工房",
      "responsibility": "JSON を検証してから HTML に焼き込む",
      "evidence": [
        {
          "path": ".apm/skills/sensei/scripts/make_plan.mjs",
          "label": "プラン生成スクリプト"
        }
      ]
    },
    {
      "id": "validate-plan-script",
      "type": "server",
      "name": "validate_plan.mjs",
      "icon": "🛡️",
      "description": "plan.json を受け取り、型・参照整合性・レイヤー違反などを検査して『plan is valid』または詳細エラーを返すコマンドラインツール。",
      "analogy": "印刷前に原稿を校閲する校正係",
      "responsibility": "壊れた JSON を make_plan に通す前に弾く",
      "evidence": [
        {
          "path": ".apm/skills/sensei/scripts/validate_plan.mjs",
          "label": "検証スクリプト"
        }
      ]
    },
    {
      "id": "plan-json",
      "type": "db",
      "name": "plan.json (スキーマ)",
      "icon": "📄",
      "description": "プランのすべてを格納する 1 つの JSON ファイル。形は reference/plan.schema.json に定義され、glossary 配列と pairs 配列を主役に持つ。",
      "analogy": "印刷前の地図原稿。情報の一次保管庫",
      "responsibility": "システムが扱う唯一の入力。スキーマに合わない形は弾かれる",
      "evidence": [
        {
          "path": ".apm/skills/sensei/reference/plan.schema.json",
          "label": "JSON Schema 本体"
        }
      ]
    },
    {
      "id": "normalize-module",
      "type": "module",
      "name": "normalize モジュール",
      "icon": "🧹",
      "description": "plan-viewer の起動直後に呼ばれ、ロードした JSON を内部表現に整えるモジュール。空のペアを落としつつ、レイヤー違反があれば即座に例外を投げる。",
      "analogy": "印刷所の受け入れ検品ライン",
      "parentId": "plan-viewer",
      "responsibility": "壊れた架空のエッジで描画フェーズを汚さないように、起動時に最終ゲートを敷く",
      "evidence": [
        {
          "path": "plan-viewer/src/utils/normalize.ts",
          "label": "normalizePlan / collectLayerViolations"
        }
      ]
    },
    {
      "id": "c4-module",
      "type": "module",
      "name": "c4 モジュール",
      "icon": "🪧",
      "description": "glossary の type と C4 レイヤーの対応表 (GLOSSARY_TYPE_TO_LAYER) を一箇所に集約したユーティリティ。レイヤー名のラベル・説明文もここに置く。",
      "analogy": "縮尺の定義表。どの記号が何メートル相当か、を 1 か所に書いた凡例",
      "parentId": "plan-viewer",
      "responsibility": "type からレイヤーを引く唯一の真実",
      "evidence": [
        {
          "path": "plan-viewer/src/utils/c4.ts",
          "label": "C4 マッピング"
        }
      ]
    },
    {
      "id": "architecture-diagram-component",
      "type": "class",
      "name": "ArchitectureDiagram コンポーネント",
      "icon": "🖼️",
      "description": "1 枚のレイヤー図を描く Svelte コンポーネント。layer プロップで自分が描くべきレイヤーを受け取り、その層に属するノードと辺だけを React Flow ライクに描画する。",
      "analogy": "1 枚の地図を引き受けて紙に刷る製図担当",
      "parentId": "plan-viewer",
      "responsibility": "渡されたレイヤーの edges を受け取り、座標とハンドル位置を計算して描画する",
      "evidence": [
        {
          "path": "plan-viewer/src/components/ArchitectureDiagram.svelte",
          "label": "ノード/辺の描画"
        }
      ]
    },
    {
      "id": "glossary-panel-component",
      "type": "class",
      "name": "GlossaryPanel コンポーネント",
      "icon": "📚",
      "description": "glossary 一覧を表示するパネル。タブが C4 レイヤー単位 (Context / Container / Component / Code) になっていて、type からレイヤーを引いて振り分ける。",
      "analogy": "地図帳の巻末索引。記号一覧をレイヤー別に並べる",
      "parentId": "plan-viewer",
      "responsibility": "glossary をレイヤー別タブで一覧表示する",
      "evidence": [
        {
          "path": "plan-viewer/src/components/GlossaryPanel.svelte",
          "label": "タブ切り替え"
        }
      ]
    },
    {
      "id": "zod-schema-module",
      "type": "module",
      "name": "plan-schema.zod モジュール",
      "icon": "✅",
      "description": "validate_plan.mjs の中核。Plan / GlossaryItem / ArchitectureEdge などを zod で定義し、参照整合性は validateReferences 関数で別途検査する。",
      "analogy": "校正係が手元に持っている朱字入りのチェックリスト",
      "parentId": "validate-plan-script",
      "responsibility": "型と参照の両面から JSON を検査する",
      "evidence": [
        {
          "path": ".apm/skills/sensei/scripts/lib/plan-schema.zod.mjs",
          "label": "zod 定義と参照検査"
        }
      ]
    },
    {
      "id": "c4-layer-type",
      "type": "interface",
      "name": "C4Layer 型",
      "icon": "🏷️",
      "description": "'context' | 'container' | 'component' | 'code' の 4 値リテラル型。レイヤーを表す言葉を 4 つに固定する。",
      "analogy": "地図帳の縮尺ラベル。1/1000・1/10000・…と数が限られる",
      "responsibility": "コード全体で『レイヤー』という概念を 4 値に閉じ込める",
      "evidence": [
        {
          "path": "plan-viewer/src/types.ts",
          "startLine": 1,
          "endLine": 1,
          "label": "型エイリアス"
        }
      ]
    },
    {
      "id": "glossary-type-type",
      "type": "interface",
      "name": "GlossaryType 型",
      "icon": "🧬",
      "description": "person / external-system / client / server / cloud-service / db / class / module / function / table / interface の 11 値リテラル型。glossary 項目の type フィールドが取る値を 11 種に閉じる。",
      "analogy": "地図記号の規格表。使ってよい記号を 11 種に限定する",
      "responsibility": "type フィールドの取りうる値を 11 種に固定し、レイヤー判定の入力にする",
      "evidence": [
        {
          "path": "plan-viewer/src/types.ts",
          "startLine": 3,
          "endLine": 18,
          "label": "11 種の type 列挙"
        }
      ]
    },
    {
      "id": "type-field",
      "type": "interface",
      "name": "glossary[].type フィールド",
      "icon": "🔖",
      "description": "glossary 各項目に必須の type フィールド。値は GlossaryType 型の 11 値のいずれか。これ 1 つでその項目がどのレイヤーに属するかが決まる。",
      "analogy": "地図記号の種別シール。1 つの記号には 1 種類しか貼れない",
      "responsibility": "1 項目 = 1 type = 1 レイヤー、を成立させる単一の決定点",
      "evidence": [
        {
          "path": ".apm/skills/sensei/reference/plan.schema.json",
          "startLine": 39,
          "endLine": 54,
          "label": "JSON Schema 上の type 列挙"
        }
      ]
    },
    {
      "id": "architectureDiagrams",
      "type": "interface",
      "name": "architectureDiagrams フィールド",
      "icon": "🗂️",
      "description": "State (currentState/proposedState) の中で、レイヤー別の図を最大 4 枚保持するオブジェクト。キーは context/container/component/code の 4 つで、書きたいレイヤーだけ書けばよい。旧 architectureDiagram (単数) を置き換えた。",
      "analogy": "1 冊の地図帳の中の見出し。『広域編』『市街編』『建物編』『部屋編』の各章を独立した別ページに持つ",
      "responsibility": "1 つの状態説明をレイヤー別に分けて持つ容器",
      "evidence": [
        {
          "path": "plan-viewer/src/types.ts",
          "startLine": 81,
          "endLine": 88,
          "label": "ArchitectureDiagramsByLayer 型"
        }
      ]
    },
    {
      "id": "type-to-layer-table",
      "type": "table",
      "name": "GLOSSARY_TYPE_TO_LAYER テーブル",
      "icon": "🧭",
      "description": "11 種の glossary type を C4 レイヤーへ振り分ける単純な辞書。person→context、client→container、class→component、function→code、のように静的に固定されている。",
      "analogy": "地図記号と縮尺の対応表。これ 1 枚で『記号 X はどの章に載るか』が決まる",
      "parentId": "c4-module",
      "responsibility": "type からレイヤーを引く一意の写像",
      "evidence": [
        {
          "path": "plan-viewer/src/utils/c4.ts",
          "startLine": 5,
          "endLine": 21,
          "label": "対応辞書"
        }
      ]
    },
    {
      "id": "collect-layer-violations",
      "type": "function",
      "name": "collectLayerViolations 関数",
      "icon": "🚨",
      "description": "plan を走査し、各 architectureDiagrams[layer] の edge の両端 glossary の type がそのレイヤーに属しているかを確認する関数。違反箇所のパスと期待レイヤーを配列で返す。",
      "analogy": "巻頭索引と本文の食い違いを洗い出す校正の最終確認",
      "parentId": "normalize-module",
      "responsibility": "レイヤー違反を漏れなく拾い上げる",
      "evidence": [
        {
          "path": "plan-viewer/src/utils/normalize.ts",
          "startLine": 86,
          "endLine": 101,
          "label": "走査ロジック"
        }
      ]
    },
    {
      "id": "validate-references",
      "type": "function",
      "name": "validateReferences 関数",